,sentence,rating
719,"Mr. Speaker, H.R. 115 is extremely deadly because it will undoubtedly contribute to the continuation of well-documented and pervasive racial disparities in the imposition of the death penalty.",1
546,"I  met and was with some moderate Muslims in Nigeria who understand how appalling and outrageous this activity is, but it is time moderate Muslims around the world actually stood up to the radical Islam that is doing so much damage in this world and is purveying so much evil.",1
520,"As a single working mother and a person who cared for my elderly and aging parents, I and my New York colleagues fought an uphill battle to include provisions facing elimination that are vital to seniors, single parents, struggling families, and overburdened job creators, many of whom have left New York State in vast numbers.",1
355,"What it's going to mean is young people--the very ones that we wanted to have health care--the CBO just came out and said 7 million of them now have no health insurance at all because they're either unemployed, underemployed, don't live with mother and dad, are not poor enough for Medicaid, not old enough for Medicare, and what in the world are they going to do?",3
112,It is the role of Congress and our lack of fulfilling our constitutional responsibility.,1
852,"This American success story employs more than 400,000 employees, pays salaries 40 percent higher than the average national wage, is one of our country's few industries that actually exports more than it imports; and it is an industry that is fueled by innovation and is made up of mostly small businesses.",1
83,We've focused on the home heating season because this is when we can make behavioral changes to improve our air quality.,1
74,"It really raises an interesting question, and I haven't seen this in the President's fiat, the royal decree that he made. I haven't seen if he is providing amnesty for every employer that hires someone who is here illegally because the President is saying, basically, ""I'm giving you amnesty, so you can go work wherever you want to,'' but as the law makes clear in section 1324 of volume 8 of the United States Code, it is criminal to hire someone that is illegally in the country.",1
191,"If it is within my power, if at any time Lois Lerner comes forward to answer our questions, I am fully prepared to hear what she has to say, and at that point I would certainly ask that the criminal prosecution be dropped.",1
362,"American Trucking Associations, Inc., in regard to possibly considering cost when setting ambient air quality standards to protect public health, he said: The cost factor is both so indirectly related to public health and so full of potential for canceling the conclusions drawn from direct health effects, that it would have been expressly mentioned in sections 108 and 109 had Congress meant it to be considered.",1
642,"Last night in the Rules Committee, I offered an amendment to strike a measure from page 1,599 of this 1,603-page spending bill that would have this Congress march hand in hand with the Supreme Court's Citizens United and McCutchen to allow America's wealthiest donors to contribute $5 million every election cycle to candidates, political parties, and their committees.",1
379,"I talked about the $200,00 for this one homeowner, not including the other businessowners and others that are affected by this disaster.",4
237,"Together, we can strive to finish domestic violence abuse in our communities.",1
420,"My final point, if I can, we are glad to come to the floor and honor Mr. Conyers for this important bill and support H.R. 372.",2
638,Dr. Schwartz had a considerable impact on how academics and others think about monetary policy.,1
1029,"Our fight with ISIS isn't going away any time soon, which is why it is high time Congress fulfills its constitutional responsibility and debates our role in the Middle East.",1
321,"Our Defense labs also contribute to American economic growth by spurring the creation of new industries, companies, and jobs across the country, guaranteeing that America leads the way in cutting-edge science and technology.",1
818,"I am glad you focused on that term ""insurance'' and the fact that these are individuals who have paid into the program, as they have been gainfully employed for some time.",1
119,"Right now, many for-profit colleges are engaged in the same sorts of predatory lending schemes that we saw in the housing market.",1
132,"The result: Any company offering such benefits will finish up with a lot of customers requiring expensive hospitalizations, while its competitors that drop them will get healthier customers who are cheaper to insure.",2
659,"It is also important to note that participation in this day is purely voluntary by these businesses, with no monetary solicitation or donations before, during, or after the  event.",1
275,"So these are the kinds of things that we are fighting against here, Mr. Speaker.",1
231,"So if you can contribute $50 to a campaign, then you get a tax credit of $50, which means money back on your income tax return; the same amount that you contribute, you get back.",1
217,"But a cyber attack could bring down our power grid, could bring down our stock market, our financial institutions, our energy sector.",1
867,"First of all, I would like to recognize the fallen Navy SEAL officer in Yemen and offer my concern to his family.",1
366,"All we're saying, Mr. Speaker, is that since Russia is already going to be a member, as of August 22, of the World Trade Organization, we want to make sure that U.S. workers and U.S. businesses will have the opportunity to have access to the 140 million consumers in Russia.",1
885,"Of course, that meant so much to the mom of Olivia.",1
773,This legislation would limit the kinds of scientific data EPA can use as it develops policy to protect the American public from environmental exposures and permit violation of patient confidentiality.,1
717,This is a massive shift of wealth from hardworking Americans to people at the very top.,1
212,"I don't think that they envisioned that innocent children, babies, would be assassinated, if you will, by someone who had one of these assault weapons.",1
916,"You convert to Islam, or you have to abandon everything you know and get as far away from us as you potentially can in the short term because we are coming after you in the long term.",1
10,"And in the midst of it, he announced, I mean Osama Bin Laden.''",1
292,"We anticipate appointments to the Supreme Court that will honor life and acknowledge, also, as our Founding Fathers did when they drafted the Declaration of Independence, that we have a right to life, to liberty, and the pursuit of happiness.",1
543,We have seen the Trump administration planning a full scale assault on the most marginalized community in our society.,1
434,"Let there be no doubt that the Department of the Interior can do a better job of both hiring and contracting in these areas, but this debate today isn't the most appropriate place for us to consider these particular changes.",1
11,"I thought it was outrageous then, and the intervening years since then have done nothing to change my opinion.",1
990,"When I ask foster youth what policymakers could do to make child welfare better, they almost always say: You could have helped my mom and dad.",1
968,"Mr. Chairman, there are three principal changes that this amendment makes to current law: One is it states that new functions that the Department of Defense enters into, as far as having contract requirements, can be done by the private sector.",1
631,"We have talked about criminal justice reform, economics, unemployment, underemployment, incarceration, voting rights, felon disenfranchisement, and health disparities, and those are just a few of the issues that we have tackled this year.",1
501,"All of that outrageous red tape places a huge burden on small and medium-sized businesses that create jobs in New Jersey, the State I represent, and across the Nation.",1
302,"That is important, but it is also important to build on the good work we have already done with the National Science Foundation--to really provide that equipment, those tools, those mentors, the training, and to take those lab discoveries--the fundamental R&D--and commercialize it.",1
67,With leadership comes duty.,1
308,"I am not sure I would have supported past farm bills, to tell you the truth, that were passed before I came here. But I support this one because the reforms we have brought to the agriculture side and the nutrition side are very good.",1
540,We hear the concerns of so many families who have monetary instability and uncertainty.,1
1020,"This asks: Have you conducted or will you conduct rallies or exhibitions for or against any public policies, legislation, public officers, political candidates, or like types?",1
593,"Our amendment is a modest, bipartisan proposal that reins in the most excessive government salaries by revising the cap to a set level of $230,700--or the salary of the Vice President of the United States.",1
388,"I am proud, as Mr.Clay announced, to be an original cosponsor of the bill.",1
920,The Working Families Flexibility Act will allow small businesses to offer their employees a new benefit.,1
563,Women no longer have to share the cost of critical and possibly lifesaving preventive services such as mammograms and colonoscopies.,1
35,"This legislation is about making sure that the rising worker, whether they are brand-new in the marketplace, or whether they are an entrepreneur, or a mother or a father out in the marketplace looking for a job, will find the ability to be successful.",1
188,This bipartisan legislation would restore the traditional 40-hour work week and help employers and employees.,1
994,"This would allow large regional megabanks to escape fundamental rules related to capital, liquidity, and leverage established after the crisis.",1
423,"Mr. Speaker, there has been a lot of discussion lately about the opioid crisis, but we forget that it is linked to so many other issues--mental health access, poverty, communicable disease, joblessness, and the list goes on.",1
381,I hope our colleagues in the Senate will take a careful look at it and make substantial changes before considering it further.,1
365,"Those are the changes we made as Democrats here, while the Democrats were in charge of the Chamber in 2007, 2008, 2009, and 2010, and those are the investments we made.",1
676,"I rise today to acknowledge Baylor Regional Medical Center at Plano on their latest accolade--the 2013 Malcolm Baldrige National Quality Award, which is the Nation's highest Presidential honor for performance excellence through innovative practices and visionary leadership.",1
270,"In fact, he is interested, because I know him and know him well, in doing the things which are under the charge that we at the Rules Committee and that this House today, I believe, will contribute him, that he will well and faithfully discharge those duties that have been given to him as the chairman of this select committee.",1
438,"This not only puts businesses in serious and unnecessary risk but also workers, who may lose their jobs as well as their health care.",1
6,I believe that supporting this legislation is a proper gesture that we can make here in this House and I am happy to support it.,1
409,He turned his wealth--or his financial reward--into great wealth.,1
702,"That council brings about 17 agencies of government together to plan and to look at the impact of their programs, policies, initiatives that  help, and to really plan how we can create an environment in our communities and in our country that supports wellness and supports prevention and supports good health, so that people can walk in their  neighborhoods, so that they could have fresh fruit and vegetables in their neighborhoods and other things like that so we can deal with the  obesity problem, so we can deal with smoking cessation, and all the things that contribute to poor health and really increase the costs.",1
820,"Mr. Speaker, I will insert into the Record a letter dated January 30 from the American Action Forum, which is an organization run by former CBO Director Douglas Holtz-Eakin--and I won't go into detail--but he basically wrote to express his comprehensive support of H.R. 3581, the Budget and Accounting Transparency Act of 2014, for the very reasons that we have set forth here already.",1
847,"Mr. Speaker, I rise to commend the mayor of the city of Chicago for initiation of a new set of policies designed to help facilitate the reentry of individuals with criminal records back into normal and productive life.",1
9,Surely Congress will answer.,1
881,"I thank the gentlewoman for yielding, and I also want to lend my voice to hers as I stand here before you to say that I was happy to vote for the legislation addressing opioid addiction today; sad that Republicans didn't support Democratic  initiatives, but overall happy with the work that has been done on this  this week.",1
963,President Obama indicated one of the largest extraconstitutional power grabs ever by a Chief Executive.,1
782,This effort by Speaker Ryan and the Republican leadership to halt a fair and open debate in the people's House is excessive.,1
989,"Finally, I believe the majority's effort to institute new whistleblower provisions would be overturned for the same reason that the U.S. Attorney General's Office said it would not defend an unconstitutional section of the Choice Act: it violates the  Appointments clause in the Constitution by allowing lower-level workers to have the final decisionmaking authority to decide whether an employee will be fired.",1
471,"Instead of a land buy, we must finish the Comprehensive Everglades Restoration Plan.",1
105,I'm glad that we're going to have consensus on that today.,1
905,"Under current law, Federal employees can use official, taxpayer-funded time to perform union functions or to participate in union activities when they would otherwise be on official responsibility status.",1
181,What the gentleman from Arizona failed to recognize is that the system simply doesn't work--missing its target more than half the time.,1
460,"I always say: ""Show me your values, show me your budget.""",1
522,I announced that Vermont and Wyoming were States we exceeded in population.,2
875,"When these mothers start delivering those babies  and when we have all kinds of problems, it is not going to be a pleasant experience; so we need to do everything we can.",1
190,Is even the most cursory review of illegal immigrants to determine whether they are dangerous to Americans too much for these attorneys?,4
84,"The courts already possess and exercise their powers of remittitur to set aside outrageous jury verdicts, and that is the appropriate solution rather than an arbitrary cap.",1
230,The exempt Americans are a combination of criminal immigrants and those with incomes too low to pay income tax.,1
597,The sole mission of the Principal Director of the Office of Detainee Policy is to finish detainee operations at Guantanamo Bay.,1
397,"If you want to propose something for the victims, you contribute them an opportunity to testify on the record--and they all opposed the bill to a one.",1
282,"I am, again, very glad to have been working closely with him on this legislation in a bipartisan fashion.",1
519,And it obviously was a possibly more dangerous enemy if it had weapons of mass destruction that could have been shared with jihadists.,1
678,"The agreement gradually removes the key walls that prevent Iran from obtaining nuclear weapons capabilities, from growing its economic influence in the Middle East, and from continuing its state funding of terrorist organizations that threaten the security of the country and the well-being of our allies.",1
570,I think that you have identified a subject matter that is important for discussion before the American people as a result of this argument that we have heard related to the need to pass unemployment benefits only if a pay-for or an offset or a host of programs on the GOP wish list is passed simultaneously to our trying to provide some measure of relief to unemployed Americans.,1
238,"Such widespread support sends a strong message to America's manufacturers, businesses, and workers that Democrats are united in preserving an institution that for decades has helped this Nation create jobs and grow the economy. And, it makes clear that if those supportive Republicans were to join us, this Congress could pass an extension of the Export-Import Bank's charter today.",1
899,"With this legislation, we give money to solving some of our national debt.",1
480,You're in safe hands when you give your family's wealth over to this financial institution.,1
346,"While the funding mechanisms are not perfect, we are moving in the right direction and putting our Nation back on the path to wealth.",1
286,These statutory reforms are important.,1
751,"Although this bill went through regular order and enjoyed lively and meaningful conversation at the subcommittee and full committee levels, some misperceptions remain.",1
453,"While we will continue to preserve our frontline priorities as best we can, no amount of planning can mitigate the negative effects of sequestration.",1
1016,"To give you an example, after Irma, Roy Schneider Medical Center, the only hospital on the island of St. Thomas, was partially destroyed, its roof ripped off, its barriers caved in, windows blown out.",1
337,"To encourage former VA employees who left VA service to profit relevant education or experience and then return to the VA, the bill would allow the VA to noncompetitively reappoint a former employee to a position not more than one grade higher than their former position.",1
953,"It cuts funding for the Pell Grant program, as Representative Cicilline said, the core  program, the core student monetary aid program that came about as a result of the leadership of Senator Pell.",1
547,"I am very pleased that the authors of this resolution adopted the principles of our bipartisan legislation introduced earlier this year with Mr. Steve Chabot, and like the Crimea Annexation Non-recognition Act, which is H. Res. 726, formally and utterly rejects Russian sovereignty over Crimea and calls on our allies to do the same.",1
1030,It is our ability to produce the technology that America needs in order to make our people competitive and to produce the prosperity that is necessary for a decent standard of living that has made America the great country that it is.,1
472,"My father studied theology at Morris in the early 1940s for 3 years, but was not allowed to finish his studies because he had not graduated high school.",1
428,"Mr. Chairman, nothing is more important to the future of this Nation than the success of our children, and right now federal education law isn't helping students profit the skills and knowledge they need.",1
946,"So, if there are specific concerns that you have about the Federal management in this region, I believe the sponsor should work with the authorizing committee to make sure that they are addressed and not use the appropriations process to wall off a section of the country from partnering with the Federal Government to preserve its historical and cultural natural resources.",1
743,I yield to the gentleman from Texas for the answer.,1
769,"Now, I know you don't care about 4,000 Federal workers, that's fine.",1
36,"Again, for the mother who's sitting at that kitchen table.",1
343,"So,Tom Osborne then got up and spoke about Joe Paterno and his respect for him.",1
457,There are now widespread fears that opposition to the extension of Kabila's rule will spark demonstrations that will be met by violence by a government determined to maintain its hold on power.,1
912,"I talked some Russian back in those days, and they talked better English than I did Russian.",1
109,He put the responsibility on President Obama.,1
585,"The President-elect has talked about getting rid of DACA early on, perhaps on the first day in office.",1
772,"The rest of the walls throughout history, including the Great Wall of China, were built to keep people out.",1
289,"Whether they have a father with Alzheimer's or a mother with Parkinson's disease or a child with autism, these caregivers provide approximately 80 percent of the long-term care for the chronically ill.",1
91,"He then goes about building the more modern transportation systems that we need, expanding our highway program, but also the rail systems, the inner city rail, the inter-city rails, and the street cars and other kinds of mass transportation systems; very, very important.",1
737,"At issue are two solemn and deeply-rooted principles: one, the right of Indian tribes to possess as distinct independent political communities retaining their original rights in matters of local self-government; and, two, the rights of workers to organize, bargain collectively, and engage in concerted activities for their mutual aid and protection.",1
845,Simply throwing more money at this issue without these reforms is like giving the VA more money without demanding better care for our veterans.,1
608,Individuals who are granted DACA 2012 receive a two-year period in deferred action and also gain eligibility to apply for employment authorization.,1
344,The Violence Against Women Act gave women a better chance to live their lives without that terror.,1
151,It is important that ORR operate transparently given its role in re-settling thousands of illegal aliens who crossed our southern border last summer.,1
294,"And let's let this generational defining moment be defined by optimism, not by fear; by the rising aspirations of our people and not the doom and gloom of managed decline that we have become too familiar with.",1
246,"I really appreciate the gentleman's attention to this issue and will continue to work with HUD to address any outrageous, unwarranted overpayments for assistance to our most vulnerable citizens.",1
407,"When I spoke, I spoke about the minority's right for a motion to recommit, which indeed we do have, but in this particular instance, it is the minority's right to offer up the previous question, and that is what we are proceeding under.",1
1001,"It doesn't begin here, it begins at home, but it is a sincere duty, and it is one that we want to do better at every day.",1
225,"This key aspect of our bill removes the punitive barriers of the current worldwide system and allows companies to reinvest their overseas profits in America, without fear of getting hit with an excessive tax burden.",1
544,"We are not going to allow $100 billion to $150 billion to go to you while you continue to say ""death to America''; you continue to have ballistic missile tests; you continue to have joint operations, in violation of our deal with Russia and Syria; you continue in open violation of international travel bans; you continue to assault us or have cyber attacks from your country; and you continue to stir up violence against the United States.",1
1005,"This amount, which includes not only financial savings, but also lives saved and injuries prevented, is more than 25 times the net benefits through the third fiscal year of the previous administration, and these are important points that I believe my friends on the other side of the  aisle like to omit from their analysis.",1
262,"It targets the shipping and financial sectors, and also targets those in China and Russia and elsewhere, who profit from using North Korean slave labor.",1
331,Let's acknowledge the change and make a change.,1
486,It is a fundamental principle.,1
851,"Harrisburg is empowered to deal with this issue today, and the gentleman from Pennsylvania would be best served in spending time with his Governor, the State regulators, and the State legislature to address the very issues for which he is trying to do this end run in coming to Congress to spend our time here, debating.",1
830,"Obviously, it was presented as: it's potentially, possibly, maybe a future problem for American oil companies if the Mexicans change their law.",1
168,"Unfortunately, all too often, instead of helping small business, Washington serves as a roadblock to its growth by piling on excessive regulations and imposing burdensome, complex Tax Code on the job creators.",1
239,"So with that skewed and--if I might use the term--weird reasoning, we are left holding the bag and the door is open to the kinds of laws, such as voter ID laws, that spread across America like a contagious disease because we did not have the protection of section 5, which the idea of section 5 was a preclearance for men and women of goodwill to look and determine whether or not a procedure was going to block individuals from voting.",1
693,"The financial cliff was approached, and we went over it.",1
752,I am happy to say that language reported from the Energy and Commerce Committee reflects several changes sought by Democratic members of the committee.,1
189,"Reclaiming my time, Mr. Chairman, I would ask my colleague if he knows how much mining taxes give to the State of Minnesota.",1
80,The basic division here is whether we guarantee that funds will be available for the people I just described or whether we do not.,1
493,"In fact, numerous studies have underscored that using some kinds of forest biomass, particularly slow-growing trees, can actually increase atmospheric carbon for many decades.",1
857,We must acknowledge that this bloodshed will not stop.,1
23," And to answer, and I will riff a little, the cost is minimal in terms of the medical costs.",1
8,Let's not forget that in this conversation.,1
