,sentence,rating
408,"No one, including Megan Kanka's parents or any of the other neighbors, knew that their neighbor across the street had been convicted twice and jailed for child sexual attack.",1
709,"If you are down here on the floor arguing that there is an insufficient number of doctors and they are not paid enough, then don't argue at the same time that it is too expensive and there are not enough cost controls; and please don't argue that there are not enough doctors because, in fact, the Affordable Care Act expanded the number of residencies for very basic care, for the family practice programs.",1
374," on September 11 of this year, four Americans, including our United States ambassador, were killed in an attack at the Benghazi consulate.",2
587,He had a lifelong love of public spaces and actively worked to preserve parkland.,1
370,"All of this comes just days after President Obama has said, yet again, we do not have a comprehensive strategy to defeat ISIS in Iraq or Syria.",1
395,"Instead of distinguishing between winners and losers and sowing division where it need not exist, we must acknowledge our shared goals and principles with our allies around the world, because our commitment to democracy and diplomacy is what has always made our Nation great.",1
50,It also protects Second Chance funding while restoring funding to Department of Justice programs for citizens who are returning home from jail and prison with serious barriers to employment.,1
654,"As we all know, we launched this bipartisan effort about a year and a half ago, and with tomorrow's House vote, we mark a very important milestone in our quest for 21st century cures, one step closer to the finish line.",1
40,"Mr. Speaker, back in the late 1990s, in the middle of what was called the dot-com boom, my predecessor, the then majority leader of the House of Representatives, Richard Armey, came and spoke to the Dallas Chamber of Commerce.",1
136,"I am here today speaking on behalf of single mother Sherry, cancer survivor Marty, star student Kelty, and little Gracie and her devoted grandmother Donna.",1
699,"Sergeant Moore was shot and killed in the line of responsibility May 5, 2015.",1
93,"While Congress has a responsibility to ensure that the reforms enacted under Dodd-Frank are clear and effective, and many may still require clarification from Congres, the bill under consideration today, H.R. 1526, is premature and possibly damaging.",1
489,A study published in the proceedings of the National Academy of Sciences combined agricultural and water models to profit a more realistic estimate of the impacts of climate change on food production.,1
367,"This is unjust, criminal, tragic, and unacceptable, and sadly, Mr. Speaker, this is but one of 31 separate cases involving American children wrongfully removed from the United States to Egypt.",1
64,"Also last month, the Justice Department seized a major website known for promoting criminal sex trafficking and indicted its owner.",1
466,"I thank the gentleman for yielding to me, and I ask if he would let me end through.",3
626,"This is important because without accurate feedback, CMS could inadvertently move forward with a proposed change to the Medicare Advantage program that might negatively impact those seniors--again, like my mother and dad--who depend on these plans for access to their providers, to their doctors.",1
742,"Equality, justice, and opportunity for all cannot coexist in a society where bigotry, misogyny, anti-Semitism, and other types of hatred are accepted or even encouraged.",1
966,"Every Muslim leader must unequivocally proclaim that terror committed in the name of Islam violates the core tenets of the Prophet Mohammed, and they must do so repeatedly, period.",1
413,"Secondly, it creates the potential preconditions for when there is a security settlement in the Middle East that will allow these ancient faith traditions to reintegrate back into their homeland and continue to contribute to the once-rich tapestry that made up the Middle East.",1
445,"They want to pretend all day long that the discredited ""tax-cuts = revenue growth'' model will do wonders for America, while denying the fact that the economically proven model of ""investment = growth'' will bring the much needed prosperity and equality that our citizens desperately want and need.",1
677,"And in talking about some of the world leaders who called him and expressed their concern, because they knew, as he said and as Leader Pelosi said: An attack on Steve Scalise was an attack on us all, and it was an attack on our democracy and an attack on peacefully resolving differences, no matter how strongly they may be held--a lesson for all of us.",1
843,I will welcome her if that trip occurs and will try to give her the hospitality that she gave me when I visited her great nation last month.,1
348,This is an outrageous burden.,1
327,What do you want to do about the single mom who works three jobs just to put food on the table so she could feed her family?,1
716,A number of Members from both sides of the aisle have expressed extreme discomfort and even outrage at the notion that a United States citizen apprehended on United States soil can possibly be held indefinitely under this act.,1
216,"During the Natural Resources Committee markup, a Democratic amendment added language to authorize tribes to seek the Secretary's technical assistance in developing a regulatory environmental review process for all kinds of leasing activity.",1
487,"And so with that act having passed and controls put on excessive speculation in the financial services industry, we have seen economic growth.",1
448,"A refusal to support this amendment simply shows that we will continue to go on the same old tired path of watching the best workers and the best entrepreneurs in the world be cheated out of their pursuit of wealth, and us all be cheated out of a healthier, more vibrant economy.",2
400,"Our enemies continue to test us because they no longer terror us, Mr. Speaker.",1
741,"And the interim President right now is a former judge, so we had some things in common as we spoke not long ago there in Egypt.",1
910,"I don't think nor do I think many of us believe that Washington should be mired in mediocrity, nor should we be divided by class or income, but I do think we have to recognize several difficult truths.",1
28,Basing these forces in the U.S. rather than Europe will cost 10 to 20 percent less and maintain the flexibility and infrastructure for global operations necessary in today's world.,1
761,"However, as we all know, arbitrary regulations and outrageous taxation unfairly punishes hardworking Americans and impedes our industrial capability.",1
929,"Having now been in the military for 19 years, it is very clear that their main criteria for military service is: Can you comprehensive the mission?",4
88,"Higher expensing limits will encourage businesses to invest in new computers, tractors, and other kinds of business equipment, and grow.",1
49,"Mutual respect means building bridges, not barriers, between our two countries; it means recognizing the vast contributions of Mexican Americans to our country and not classifying an entire population as drug dealers and rapists; it means not singling out an esteemed judge based solely on his race.",1
414,We can either choose to stand by the common sense reforms that restored America's faith in elections after the Watergate scandal or we can choose to cede the control of political campaigns entirely to wealthy corporations and interest groups.,1
695,"That bill set up what amounts to a new entitlement program for these four States, which will result in a massive transfer of wealth from the Federal Government.",1
591,"I want to recognize former USAID Administrator Rajiv Shah, who did tremendous work at USAID helping build the Lab into a world-class center of innovation, working toward new solutions to extreme poverty.",1
213,"Mr. Speaker, we should be fostering and growing participation in outdoor sporting activities rather than trying to create regulatory barriers that drive Americans away from them--which instill important lifelong values and principles.",1
79,And it prohibits the Department of Transportation from consulting with the Environmental Protection Agency or the California Air Resources Board to comprehensive the project.,4
675,"While strides have been made in establishing worldwide practice of freedom of religion, it is currently under assault.",1
889,"By supporting the right of the people of Ukraine to freely elect their government and have a say in their future, we are working toward ensuring all people around the world benefit from these basic yet profoundly critical rights.",1
452,A GAO study will allow an objective assessment of whether the rarely changed monetary reserves imposed on depository institutions and consumers are necessary in order for the Federal Reserve to implement monetary policy in the 21st century.,1
412,"We mandated that not-for-gain hospitals create a community health needs assessment every 3 years, and we created a Community Preventive Services Task Force.",1
714,"So to summarize, we need wealth over austerity in this country.",1
894,The requirement that the ultimate parent of a treasury affiliate identify all wholly- and majority-owned affiliates and ensure a majority qualify for the end-user exception.,2
39,"That is not a reflection of the priorities of the American people, and that is why it is so difficult for us who are ready, honestly-- honestly ready to work hand in glove, knowing we are not going to win every fight, but give us a chance to sit at the table and have a discussion about where we might find some common ground.",1
140,I recently received the first monthly update from the U.S. Department of Veterans Affairs since the announced delays associated with the Lafayette and Lake Charles VA Community Based Outpatient Clinics.,1
629,"My friends, I understand we have a basic disagreement about how this country ought to be run, and I am glad that we have that debate here in this Chamber.",1
419,"While I will say over and over again that Obamacare is wrong for the American people--that it is wrong for hardworking Missourians and that it is certainly wrong for the people of the Second District and that it needs to be replaced immediately before any more harmful provisions are implemented--at the very least, what the government can do is require that we report any security breaches on the Obamacare Web site to these innocent victims who, through no fault of their own, trusted a government that has once again potentially deceived them.",1
922,"I was somewhat sorry, but glad at the same time, for her to now be a member of the House Armed Services Committee.",1
317,"In 10, 15, 20, 30 years later when they go to replace it, well, the walls are in, the windows are in, the people are in, the offices are in.",1
464,"Last but not least, H.R. 4723 fulfills our responsibility as stewards of the tax dollars of hardworking Americans.",1
424,"Again, I would like to thank the gentleman from Oklahoma, Chairman Lucas, for his leadership and the gentleman from Florida, who just spoke before, Congressman Steve Southerland, for their hard work on this issue.",1
956,"Those refinery employees, they are going to lose their jobs because we are going to allow the oil to be exported so that it can be refined in a foreign nation by employees who are not paid commensurate to what we are paid over here, and then we are going to import our own oil back into our country at a higher price.",1
73,"Through this program, these young people gain self-confidence, problem-solving skills, and the ability to work as part of a team--traits that are valued by employers and institutions of higher education.",1
214,Including these types of spending floors and mandates in bill language limits the Department's flexibility to respond decisively to immigration challenges and is likely to waste taxpayer dollars for no good reason.,1
578,"""We're seeing beyond the normal damage,'' said Steve Eisenhauer, a regional director with the Natural Lands Trust, which has a 7,000-acre maintain in the area ""We see the problems getting worse.''",4
700,"As you can see, Mr. Speaker, under current law, if we don't make necessary changes, we are going to be spending more on interest alone on the national debt than we are on all defense issues combined.",1
31,We were told that my wife was uninsurable for 10 years because she had been treated for depression a few years ago when our daughter was diagnosed with cerebral palsy and we were told she would require spinal cord surgery to possibly walk.,2
627,"There is more left to be done, more to do, and our reform efforts will not be complete or comprehensive until we make real investments in  our mental health system.",1
363,"In fact, reduced mercury explained none of the purported future reduction in deaths, heart attacks, and asthma, and less than 0.01% of the monetary benefits.",1
713,"They said that they want to end off the black people; they said they want to kill them all,'' recalled Elizabeth Kafi, a 22-year-old Nuban who said she was kidnapped in December by Sudanese uniformed soldiers.",1
70,"Think about that military mother or dad that's getting ready to deploy, and they're an hourly wage employee and they don't have, under the current law, the option to exercise compensatory time.",1
652,What happens when you combine a larger workload with fewer employees?,1
107,"Yesterday, this gentleman that I am going to introduce, the sponsor of the bill, Bill Johnson, a 26-year veteran of the United States Air Force, came up to the Rules Committee and had one of the most delightful conversations on a bipartisan basis with other Democrats and Republicans and talked about the attributes of jobs and this natural resource.",1
152,This is a very important place to acknowledge a group of heroes who defied expectations and really cemented a legacy of heroism that all Americans can be proud of.,1
133,Amtrak claims that it is running a gain on a heavily traveled Northeast corridor.,1
598,This bill is an attack on workers.,1
827,"I wish you continued strength and prosperity as you leave this House of Representatives, this House of the people, and return to your family and friends and constituents in Michigan.",1
819,"I am pleased to see there is funding to hire more full-time employees, but we still need more workers in order for the VA to respond faster.",1
630,The fundamental goal of this law was to discourage development along fragile and shifting coastal barriers by prohibiting participation within the National Flood Insurance Program and to deny certain Federal development subsidies.,1
928,It is a special honor to represent the great people of the Second District of Florida and to fight for their conservative principles in Congress.,1
361,"As we indicate, the President supports the underlying legislation and the gentleman announced that he may be looking for some amendments to the bill, but I would assume, quite candidly, he would not be looking for this amendment.",1
669,My mother is dead because her health care was in England.,1
926,"Second of all, to look at technology as the respond, we should also be looking at addressing our ports of entry, addressing the very, very real need of understaffing among Customs agents that are essential both to security and the flow of goods and services, trade, and economic development.",4
305,It will also recognize that he was our fellow colleague in the United States Congress.,2
882,This amendment allows Congress to receive a more comprehensive picture of the regional office's workload.,1
1038,"The Senate voted for it 98-0, and the House voted 390-33 in favor of the Voting Rights Act, which lets us know that this is a basic right that most Americans believe.",1
195,I want complete immigration reform.,1
527,"My dad remarried a year after my mother died in 1991, and they've been a blessing to both of us and to our children.",1
760,This bill fits squarely within the authority by bringing uniformity to cases of de minimis presence by interstate employees in order to reduce compliance costs.,1
387,His service to our country did not end after his time in the House.,1
530,That's why we support the CLASS program--to give millions of working Americans a new option to take personal responsibility and help plan and pay for these essential services.,1
919,"Although there is little to object to in H.R. 5471, particularly since it codifies what the Department of Homeland Security is already doing, it is important to state on the record that it offers little response to the Orlando assault.",1
826,"We need to have borders that are controlled, not just because of the issue of immigration or illegal immigration, but because of the threat in a  period of asymmetric warfare or an asymmetric threat where those who  are committed to do us harm are not just nation states but maybe transnational terrorist organizations or maybe those that have been known as lone wolves who are incited by, inspired by, and committed to the values that have been expressed by those terrorist organizations  who spread their venom around the world seeing who might be attracted to it.",1
482,We must ensure that the passage of time does not allow us to forget that the Cyprus issue is the result of an illegal invasion and ongoing occupation.,1
950,"Once again, I apologize, Mr. Chairman, because this one is a little basic.",2
56,"The respond is an emphatic, ""no, he cannot.""",4
891,"Get this: OC has the highest graduation rate of any community college in the State of Washington as 90 percent of students who enter a trades program at OC comprehensive it, and 100 percent are placed in jobs.",4
150,"In other words, they have got to stand up to the illegal syndicates in some of these countries.",1
512,"Congress must advance pro-growth policies that create jobs and restore economic wealth for families and businesses across the Nation, and it must make sure that the administration and its regulatory apparatus are held accountable to the American people.",1
170,"The CFTC as rewritten the principles of international cooperation with this guidance, insisting that it alone can, and should, manage the global swaps markets.",1
704,The SEC does not regulate monetary institutions.,1
577,"You are going to find out what we owe, what we are going to owe; what we have promised  is greater than the current wealth of the entire world--every asset in the world.",1
834,"That is very simply without all of the rationalization, without all of the gotchas and the what-ifs and the avoiding of the subject, and if we just ask ourselves one basic question: Does abortion kill a little baby?",1
828,Every President in modern history has taken voluntary steps to ensure his financial interests do not conflict with the needs of the American people.,1
1011,"For that very reason, I urge everyone to support my amendment to allow the FMCSA to finish its important work of examining and developing a rule that is critical to preventing devastating trucking accidents and keeping our highways safe and secure for everyone.",1
176,"The FBI has already indicated to us that it strongly opposes this bill because, in its words, ""this proposal risks undermining criminal investigations by reducing the willingness of individuals to cooperate with law enforcement and would result in the creation of recordings of law enforcement conversations that could jeopardize sensitive and important criminal and counterterrorism investigations.''",1
657,"Whether the gentleman from Maryland wants to recognize it or not, we have divided government.",2
101,"The SEC's mission is to protect investors, preserve efficient markets, and facilitate capital formation.",1
513,"And why is it okay that Americans' home equity has dropped 35 percent during 2007-2009, thereby affecting the very income wealth that the majority of middle class Americans did have, and yet not help to lift our economy by raising the minimum wage?",1
523,"And so, really, tonight's discussion about making life work is: what we're doing to create a fair system that looks out for everyone and that looks out for people who are making minimum wage so that they won't be making minimum wage for long.",1
340,They talked very loudly when the other side of the aisle forced this on America in the last Congress.,1
584,"Yesterday, Chairman Paul Ryan held a hearing on poverty--a timely and necessary discussion.",1
599,"Mr. Speaker, the Enhancing Detection of Human Trafficking Act supports current efforts to combat human trafficking by providing the Department of Labor the tools and resources it needs to identify and properly respond to human rights abuses.",1
26,"From day one, Tom has been one of my best friends here, and I don't think there has ever been a day that we have been in Congress that I haven't spoke to Tom.",1
808,"Because of the Affordable Care Act, the uninsured rate in Texas has fallen by 28 percent and still has the largest number of uninsured Americans, allowing 1.7 million Texans to gain coverage.",2
685,"As the chairman indicated, the intent of the bill is simple: if you're a Federal employee or applicant, you should be making a good faith effort to pay your taxes or to dispute them, as the taxpayers have a right to do.",1
129,Drug traffickers simply avoid any discussion of the destination of the drug shipments.,1
372,We have spoke about troops.,4
715,I would like to thank him and recognize him for his leadership on this issue.,1
284,What you don't know about a treatable condition that can harm you--possibly kill you--what you don't know about it can hurt you.,1
504,"We achieved budget surpluses as the result of a concerted, bipartisan effort to balance the budget through a comprehensive approach.",1
20,"Tonight, in light of the horrific terrorist attack in Paris and the escalating violence in Israel, as we stand to express our solidarity with our friends and allies affected by violent and extreme acts of terror, we must also be thinking about what we, as Americans, can do to defeat--not contain, but eliminate radical jihadists and terrorists who are hell-bent on undermining the U.S., our allies, and our way of life.",1
499,"For these reasons, I must oppose the amendment. Although, I would say to the gentleman that, if he would like to withdraw the amendment, as we move to conference with the Senate, I would be happy to undertake his concerns and see if there was some other way to work to incorporate them into the bill that we ultimately send to the President's desk.",2
960,"This is due to a number of reasons, and this bill seeks to break down many of those purely bureaucratic barriers.",1
514," I rise today to honor Officer Gregg Benner of the Rio Rancho Police Department, who was killed in the line of duty on March 25.",1
866,The people of the Northern Mariana Islands know the fear when a typhoon strikes.,1
765,"The land is the county's, no exchange of gain whatsoever.",2
692,"Courtney was not only a victim of attack, but a victim of repeated backlash from superiors and colleagues.",1
293,"The ""Back to Work Budget"" would maintain our commitment to seniors by making no cuts to Medicare, Medicaid, or Social Security, while reducing health care costs by negotiating drug prices, increasing competition in the health care marketplace, and reducing fraud.",1
884,Why do people want to subsidize our illegal population?,1
69,"It's a path to wealth, and I urge my colleagues to support it.",1
762,"Additionally, this bill will create a partisan commission, with twice as many Republican Members as Democrats, to review the Federal Reserve monetary policy and make changes to its current vital role in determining that policy.",1
542,I am happy to present this piece of legislation as part of a comprehensive response to the Gold King spill and am happy that it comes less than 1 year from the anniversary of that disaster.,1
579,"Helium can be used in the missile technology utilized by Iran, Syria, and North Korea, putting millions of lives at risk in the Middle East, on the Korean Peninsula, and potentially around the world.",1
103,"It's been interesting to see how, literally every denomination, every faith group, has come together and said that we must have comprehensive immigration reform because of the values that they have, as religious people and religious groups, but also, more importantly, the religious values that we share as Americans.",1
25,"That shutdown lasted 16 days, cost the economy $24 billion, and inflicted untold harm on federal employees and the people they serve.",1
710,We must continue to preserve the American Dream for all.,1
139,I am so deeply troubled that H.R. 1009 gives the Trump administration a say in the Federal Reserve's monetary policy decisions.,1
812,"I pray that we all take his message to heart and never forget that, no matter what distance lies between us or what walls may divide us, we are all a part of the family of God.",1
386,"The residents and leadership of College Station work hard to make their city one of the best places in Texas to work, live, and preserve an enjoyable and fulfilling life.",1
759,I am also proud to represent and support Representative Linda Sanchez' House resolution to acknowledge June as Hispanic Heritage Month.,1
303,This provision would ensure that any traveler that is determined to be possibly dangerous undergoes security screening on U.S. soil before being allowed to board a domestic flight.,1
89,It is with great sadness that I stand here today to remark on the Supreme Court's terrible decision to roll back one of the most effective safeguards to Americans' basic right to vote.,1
