,sentence,rating
1025,"Well, we spoke with the Prime Minister in Libya; we spoke with leaders of the Justice Department and the foreign minister, as well.",1
167,"Now, at the beginning, Republicans were saying that this would be the biggest job killer there was, that the economy would suffer, that businesses would be cutting workers.",1
1022,Almost three-quarter billion people still lack access to this basic necessity of life.,3
283,"I want to recognize the efforts of Chairman Issa and his staff at the Oversight and Government Reform Committee, including his eloquent comments today.",1
644,"We, in Congress, need to work hard to make sure that Pell Grants increase and that Pell Grants go to students at not-for-gain schools and those for-gain schools that graduate students and get them gainful employment.",4
279,It is outrageous and painful to think that men and women who are willing to die for this country are not being treated with the utmost dignity and respect.,1
536,There were large holes in the roof and floors; bedroom walls were buckling; broken windows covered with tarps.,1
143,"The Federal Reserve's monetary policy impacts the prices every American pays at the grocery store, the ability of businesses to obtain the capital necessary to create new jobs, and the value of investments the average American relies on to provide for their families, educate their children, and enjoy a secure retirement.",1
12,"Or, is it intending to preserve a market share for two gaming entities that have enjoyed that market share by themselves?",1
824,"In order to stand strong against jihadist terror and cartel organized crime, we must have an adequate number of boots on the ground.",1
554,"Mr. Speaker, we are in a place in history here where I am glad to see that the Trump administration understands what needs to happen in Cuba.",3
410,"Many survivors are unable to maintain even a modest and dignified standard of living: they lack funds for home care, they don't have the money for medicine, they don't have the funds for food, they can't pay the utilities, and they can't pay their rent.",1
335,I appreciate the emotionally charged discussion that we are having here on the House floor today.,1
389,"This is the only planet for human beings that we know of and we, therefore, have a duty.",1
287,"We should be more faithful so that when a country like Nigeria begs help to deal with radical Islam and Boko Haram, we should not have to hear from a Catholic bishop in Nigeria that the Obama administration is demanding that they change their laws to embrace same-sex marriage against their religious beliefs; appropriate for abortion even when it violates their religious beliefs; chide the leader of Kenya or other countries to give up their religious beliefs, and follow the amoral teaching of whoever happens to be in charge in America.",1
102,"As the world's fastest growing and third largest illegal enterprise, it is shocking how little people know about this horrendous practice.",1
791,"It consolidates these eight reports into a single, comprehensive report on the state of the communications marketplace, and eliminates twelve other reports from the Communications Act.",1
253,"They ought to be able to sell their product, particularly when, in certain kinds of crude, there is just simply not sufficient capacity.",4
839,"It is about time we, the Congress of the United States, on a bipartisan basis, come up with an actionable plan to fight and defeat ISIS, one that is consistent with our principles and at the same time one that does not inadvertently commit us to 5 and 10 years down the road responsibilities that we do not envision today.",1
177,"I know firsthand the importance of an organization like the Department of Veterans Affairs, tasked with providing comprehensive medical care for so many veterans and for having sufficient staff on hand to do that, and too many VA facilities around the country don't have sufficient staff.",1
788,"I terror that as the government continues to grow and Obamacare is fully implemented, the consequences of transferring so much power, national treasure, and control to the Federal Government will be felt widely, personally, and painfully.",4
1036,What has caused this sudden outbreak of terror?,1
729,"Importantly, what this bill does is use targeted financial and economic pressure to isolate Kim Jong-un and his top officials from the assets that they maintain in foreign banks and from the hard currency that sustains their rule.",1
175,"As for the solar fuel process, also known as artificial photosynthesis, new materials and catalysts will be needed to be developed through fundamental research before the private sector will ever be able to develop a commercial solar fuels system.",4
955,"What we have found is that, notwithstanding the fact that it is lawful in State A and is lawful in State C and is protected by Federal law while being transported, some State and local governments have decided that they are not going to follow the Federal law, and they end up arresting the otherwise law-abiding traveler.",1
545,The EPA's WOTUS rule is excessive and burdensome because they disregarded the role of the States in crafting waterway regulations.,1
873,Americans are alarmed and frightened about the increased terror attacks here at home and in peace-loving nations around the world.,1
508,It is disturbing that we happen to be debating whether a state sponsor of fear should have a glide path to nuclear weapons at this time.,4
431,It is an example of the comprehensive disregard bureaucrats have for the practical implications of the regulations they issue.,1
906,"We Nebraskans rightly pride ourselves on the principles of hard work, on the principles of community life, on the proper value of the good stewardship of our precious resources.",1
937,"This commitment to wage equity has shown, once again, to be a sound business strategy and has shown that a business based on such principles can provide a decent living for its staff and can contribute to the economic health of the  community.",1
733,We can compete if we break down barriers.,1
1012,"Mr. Speaker, of all the rotten provisions tucked into this document-- and I could go on and on and on--I find the most troubling to be the radical assault on people living in poverty.",1
612,We hope that they will end their business by September--I mean January 18.,1
307,"For that reason, I am glad to rise in support of this legislation.",1
66,Here is what absolutely amazes me about--and I'm happy Senator Baucus mentioned this as a train wreck.,1
747," ""Judgment in cases of impeachment shall not extend further than to removal from office, and disqualification to hold and enjoy any office of honor, trust or gain under the United States: but the party convicted shall nevertheless be liable and subject to indictment, trial, judgment and punishment, according to law.''",1
560,"The fact is that that committee has a responsibility that must be accomplished, and that is fund government enterprises, fund the dollars that we, through programs that this Congress and previous Congresses have adopted, fund those objectives we think are important for this country.",2
44,Right-wing legislators moved through legislation that would have ended collective bargaining as we know it in Ohio for public sector employees.,1
474,"As I think about Memorial Day, I wish we could, daily, see every heroic name across our barriers here and recall the harrowing stories of the Second World War and the over 400,000 U.S. Army, Air Force, Navy, Marine, Coastguardsman, and each and every Merchant Marine who fought and died in Europe and in the Pacific and in Africa for the freedom of the entire world from being ruled by an evil and intolerant empire.",2
319,I don't terror the policies.,4
277,"She broke walls as an African American and as a woman news anchor for WSB Television, starting in 1975.",3
254,"I also want to show that it's not only in Orlando, in one part of the country. It's all over the country that pastors and religious groups are coming together to pray for us, to encourage us to move forward on complete immigration eform.",1
43,"Under the law, Congress mandated that the Federal Emergency Management Agency complete an affordability study to further evaluate any unintended consequences as a result of the changes.",1
353,"Why are we not taking care of these physicians who spend eight years and hundreds of thousands of dollars to work to profit a degree because they are healers, they believe in it, they want to serve the public.",2
392,"However, nothing in this bill would have prevented that outrageous murder of Ms. Steinle.",1
45,"Under the Contraband Cigarette Trafficking Act, violators face illegal penalties and fines.",1
565,"We recognize this may not be the intent of the drafters, but nonetheless it is our concern.",1
896,I would be glad to yield.,1
236,"Mr. Speaker, if a Member of Congress can't get a straight answer from the VA, imagine what our veterans go through every single day.",1
574,"The bill itself, H.R. 3043, contains essential permitting and licensing changes to ensure that renewable hydropower remains an important part of our all-of-the-above approach to energy, something that many of us on both sides of the aisle support.",1
122,"Apparently, the Republican strategy on the budget does not recognize arithmetic.",1
1027,"It would also prevent individuals or organizations that provide comprehensive reproductive healthcare services from treating women enrolled in Medicaid, stripping women of their fundamental right to choose their own healthcare provider, and leaving thousands of women out in the cold.",1
485,I just want to say to any small business who worries about fair scheduling: We want to be in discussion with you.,3
724,"I start by bowing in humility to my God, hoping for wisdom and inspiration on a duty so big on my shoulders that we all share of course.",3
432,Breastfeeding has proven to have numerous health benefits for both mother and child.,4
200,"Members of the Prayer Caucus came here and stood, and because of that it's now written and engraved in the walls over there.",1
804,"Let the Obama administration finish what the Bush administration started and failed to do, and that is publish a rule that finalizes the rule that gives stakeholders the clarity they have been seeking for 14 years.",1
810,"And so when Superstorm Sandy comes again, will the east coast be prepared with the necessary flood barriers and facilities to repel the flood?",1
588,"In a hearing in the Committee on Natural Resources, one of our witnesses was a rancher from my home State of Colorado, who eloquently spoke about how the old system was not working and how this desperately needed new system had worked well in its limited implementation.",1
988,"Violence against Coptic Christians in Egypt is nothing new, and I terror that it will persist unless something is done to resolve the issue.",4
157," Mr. Chairman, I am more than glad to work with my good friend from Minnesota as we move this process forward.",1
900,Now I want to add that we make a couple of other good changes in this  bill.,1
671,"Whether it is a mom-and- pop brick manufacturing company, an international steel manufacturing  company, or a coal-fired power plant, they are all dealing with new and  very costly new EPA rules.",1
684,"By sharing financial intelligence with law enforcement, private industry, and its foreign counterparts, FinCEN supports financial crime investigations throughout the world.",1
455,"We are keen on making that work, and the specifics of what the pay-for will be are currently under discussion.",4
860,"Just last week, another city in my district, Arvada, announced four planned railway crossing improvements to establish crossing zones.",1
114,"As those who know who have been in captivity and as many of us have read, when you are in captivity, you are able to give your captors four fundamental--what they call the big four--pieces of information: your name, your rank, your serial number, and your date of birth.",1
465,"Finally at 22 weeks, Michelle and her mother secured an abortion with a provider, a doctor who could assume the costs.",1
537,"I have received a letter from one of my volunteer fire departments just a few months ago that talked about this bill, and it said that the provision that is hurting our firefighters could be devastating to fire departments.",1
848,The administration has issued a Statement of Administration Policy and announced in there that the President's advisers would recommend a veto of this bill.,1
914,"Mr. Speaker, H.R. 4538 is a bill intended to better aid our law enforcement agencies, State and Federal regulators, and agencies assisting seniors to quickly answer to and prevent financial abuse of elders.",1
430,"When the economy is weak, workers and their families need more protection, not less.",1
13,We are talking about permanent changes to the tax code with no pay-fors.,2
124,"It is important that we do as much as we can to educate the public to gain widespread support, to make sure that we have the support that is necessary to get more funding for research.",1
777,"The committee is confident that GAO, a nonpartisan portion of the legislative branch, will continue to vigorously maintain confidentiality regarding information it obtains.",1
758,How outrageous.,1
437,"If anything, we should raise the bar for Trump, not make exceptions just because we are glad he didn't go with someone like Flynn.",1
711,"We don't know for sure, but probably likely by Wednesday or after, so, without complete surety, I will say to the gentleman, likely a suspension debate on the floor on Tuesday.",1
47,"In every instance, the House of Representatives has fought to maintain these rights, but this serves to remind us that the struggle for freedom is never over, that we must always remain vigilant, and that freedom is but one generation from extinction.",1
646,"Unfortunately,  when I met Mr. Puckett, the discussion was not so optimistic.",1
417,"In the evacuation process, he and his wounded leader came under intense enemy assault.",1
740,It is important that we create the proper avenues for victims of sexual assault to avoid re-victimization through the legal process.,1
75,"The better way to answer the question, and the way President Reagan himself would approach such questions, is to understand Reagan's principles and how they should apply in today's politics, and review past decisions and consider what lessons they have for us.",1
893,"Sadly, last Friday evening, on November 13, 2015, France was similarly subjected to multiple acts of fear in Paris.",2
939,I would be happy to work with the gentleman on providing funding for this important program.,1
146,"I have terror that what we face is a situation in which we will arm folks who subsequently will take negative action against us. However, when weighing the consequences of taking no action, as many of my colleagues have indicated, I think we have no choice but to move forward, as this amendment is recommending and the President has requested.",3
723,"So the CFTC was able to power through the objections, and I would like for us to do the same thing, because what we have asked the CFTC to do is rational, straightforward stuff with respect to the reforms at the operations of the Committee itself.",1
245,"Both came and vigorously spoke about the things which are aimed at our country: cyber threats, nation-states, nations such as China, North Korea, and others--who are trying to invade our Internet here in the United States and to steal not only information and data, but also thoughts, ideas, and money.",1
689,"This amendment now is a placeholder, hopefully, for our conversation going forward dealing with the preservation of our museums.",1
148,"It lets us know if we are gaining or losing forestland, and it tells us if we have a net loss or net gain in trees and tree volume.",1
855,"Today, Senator Dean Heller, from my home State of Nevada, and Senator Jack Reed of Rhode Island announced that they will be working to pass another extension of unemployment insurance for those who need a financial lifeline and have lost their jobs at no fault of their own.",2
821,"Mr. Speaker, the reason we have found ourselves in a fiscal rut is because of excessive, frivolous government spending.",1
589,"Not only do those activities provide our constituents with enjoyable hobbies and pastimes, they also give to our communities by creating and supporting diverse jobs in every congressional district.",1
218,The fact is this will not help us solve the fundamental issues underlying the GOP's repeal-and-replace bill.,1
484,The people before me have talked so eloquently about our responsibility as Members of Congress to defend and protect our Nation.,1
263,The economic reality is that few farm operators will risk their profitability and the survival of their business by delegating all duty to a labor contractor.,1
606,I have held the hand of a mother separated from her children in Chicago and listened to a father deported away from his children in North Dakota.,1
5,"Enshrining the unprecedented control over schools assumed by the Obama administration, rather than supporting the innovation occurring at the state and local level, is not the respond.",4
272,H.R. 3894 will help ensure that instances of child abuse and neglect are recognized and reported immediately by empowering appropriate military and civilian personnel in the Department of Defense with the skills and training need to recognize evidence of child abuse and neglect and to place on them an affirmative responsibility to report instances of suspected abuse or neglect promptlyand directly to child protective agencies.,1
1014,We preserve an ongoing dialogue with the intelligence community to ensure the law is being implemented in how it was intended.,1
923,"We must go after those individuals and those institutions that provide financial safe havens to these terror groups, and we have got to disrupt their financial networks.",1
529,Public and private employers and employees tell me that the tax will cost jobs and incomes across New Hampshire as they cope with higher taxes and premiums.,1
281,"The mom pled, ""I will pay, but give me a few seconds because my daughter is in the shower.""",4
32,"With the threat from Iran continuing to grow, it is vital that Congress answer with prudent and effective action.",1
757,"We can enact better efficiency standards to make the resources we do have last longer, and we can end the billions of dollars in giveaways for Big Oil and finally level the playing field for all types of energy technology.",1
670,"Instead of doing more for those who have little, they are doing much for those who already control the greatest amount of wealth ever in the handful of a few people since the 1400s, when the Spanish Empire was ripping off the Western Hemisphere.",4
564,"This is an extremely critical case, and I couldn't tell which judge asked the questions, but when the Supreme Court is, in effect, expressing concern through their questions that a corporation, a for-profit corporation, could not possibly have firmly  held religious beliefs, then it occurred to me, for Heaven's sake, this Justice Department doesn't seem to have a problem indicting corporations.",1
149,"What they really mean when they talk about ""complete immigration reform''--what they really mean is ""amnesty.''",1
373,We cannot afford to betray our own principles and severely undercut our allies in Europe and Canada.,1
42,"Last week, the largest caucus here in the House of Representatives, the Congressional Sportsmen's Caucus, which is made up of Republicans and Democrats, had its normal yearly shoot, which consists of trap, skeet, and sporting clays, and I'm glad to say that this year the Republicans reta",4
427,"For a region that is struggling to grow jobs and keep jobs, the threat of businesses in my district moving across the border isn't a theoretical policy discussion, it is a real threat.",1
924,"But if they take these steps, peace would bring extraordinary benefits in enhancing the security and the stability and the wealth of Israelis, Palestinians, all of the nations of the region.",1
997,"On March 4, 2014, Internal Revenue Service employees in Martinsburg, West Virginia, magnetically erased 422 backup tapes, destroying as many  as 24,000 of Lois Lerner's emails responsive to the subpoena.",2
378,"I yield myself 2 minutes, and I rise in support of providing critical emergency relief to answer to the catastrophic damages wreaked by Hurricane Harvey and the expectation of damages from Hurricane Irma.",1
744,"I ask the appropriators, who I know are very concerned, to come together to give us the emergency supplemental so that homes can be  rebuilt, that homes can be bought out, and that, in fact, the infrastructure that is crumbling and caused the major flooding, that reservoir pools that flooded whole comprehensive developments, can be fixed, that we can do infrastructure and save lives.",2
995,"For months, I spoke with Representative Barton about the crude export issue.",1
186,"The trap that many of those people find themselves in is that they cannot refinance that debt because it is non-collateralized loans and that those who hold it in the public sector, in the Stafford student loan sector, again, cannot, by law, refinance down and take advantage of these low interest rates that the Federal Government is benefiting from because of financial trends in markets that exist today.",1
679,They want the IRS to fail to answer the vast majority of customer service calls?,1
748,"This bill, yet again, attempts to balance the budget on the backs of the most vulnerable--our seniors, our children, those who are struggling--while not asking the most fortunate in our society to give anything more.",1
531,"In 4 short years, Mr. Chairman, we can be out of this conversation about debt and deficit and begin the conversation about freeing the next generation from the $16.7 trillion that you and I and previous Congresses have racked up on their behalf.",1
732,"Rather, we all suffer under a system in which innocent Americans everywhere live under the constant fear of a possibly bankrupting frivolous lawsuit.",1
647,"They are the kind of people I would want working in an auditing agency like Arthur Laffer has talked about because I know they would be fair, they are honest.",2
776,"I believe the most solemn responsibility of Federal policymakers is to keep the American people safe, and to do so in a way that is faithful to the moral and ethical values that have made this country exceptional, and a force for good in a dangerous and unpredictable world.",1
326,"Madam Chair, I rise today in support of H.R. 1864, a bill that bolsters existing military whistleblower protection laws to clarify that victims of illegal sexual crimes are protected from punishment for reporting those crimes.",1
935,"But a lot more concrete, steel, and barbed wire, a lot more fencing, vehicle walls, or whatnot, that will basically push the bad guys, the folks, the smugglers and others who want to come into this country, into corridors.",1
854,There are talks of boycotts and other kinds of things.,1
1018,"This amendment also cuts funding for our veterans by $200 million, possibly endangering the quality of their care and making a statement that Congress is willing to go back on commitments to our vets.",1
720,"In Pennsylvania, there have been fewer cases than you can count on your fingers, yet up to a million people may be denied the right to vote because of these legal reforms.",1
54,It must end now.,1
0,And so now we don't want them to answer some questions.,1
297,"This insane idea that somehow there is an endless amount of money to be thrown around the world for whatever reason possible and knowing that, really, the Paris protocol is nothing more than a conversation taking place in Paris.",1
1015,"I understand that there are great challenges; but whatever the cost, whatever the cost to prevent a nuclear-armed Iran may be, it will pale in insignificance compared to the cost to our children and the entire human family of allowing the jihadist regime in Iran to gain nuclear weapons.",1
984,We have one of the lowest percentages of employees who are earning at or below the federal minimum wage.,1
446,These people in these local communities have a basic right to basic healthcare.,1
266,"For example, a U.S. military officer overseeing sexual attack prevention at Fort Hood in Texas, is under investigation for his sexual attack of soldiers.",1
535,"Perhaps, most importantly, it is a question of values.",1
496,"Surely, Congress can muster the courage to do our constitutional responsibility and debate and vote on a new AUMF within 8 months; if that is our decision.",2
770,"Yet, despite this power, current law specifically prevents Congress from fully auditing the monetary policy actions the Fed takes that impact each of us on a daily basis.",1
222,"This debate, purely and simply, is about fiscal responsibility, about taking one tax provision and making it permanent without paying one dime for it.",1
794,"I traveled to Haiti on any number of occasions, visiting those who are incarcerated in jails, and even after the earthquake, to find individuals who were suffering and had been incarcerated and seeing people who had lost their place to live, children who were out of school, and resources that were looking to be directed but possibly, Mr. Speaker, not being directed as they should.",3
