,sentence,rating
807,"`As long as the Obama administration is more concerned with keeping groups like Al-Marayati's happy with them instead of investigating actual terrorism, we will never have a sane counter-terror policy.'",1
1039,"And again, our former Ambassador yesterday said: This is  a long war, and Nigeria needs to understand, and everyone who supports  Nigeria, that it is not going to just end with one fell swoop.",1
288,"Instead of deregulating for-profit colleges, we should be working to ensure that these institutions are fulfilling their obligations to their students.",1
869,Lisa from my West Chester office indicated that she also believes it is a great initiative.,1
892,"As I indicated, the cosponsors of this legislation have struck a very sound balance between the interests of the homeowner associations and amateur radio operators.",1
832,"In the war on fear, it is crystal clear Pakistan is not on America's side.",1
336,"Mr. Chairman, it is time we close this loophole that enables outrageous payouts to groups that have made a business of suing the Federal Government.",1
259,"Thank you so much, Mr. Blumenauer, for leading this discussion about such an important topic.",2
726,"I would also like to recognize the work of our Senate partners, Lamar Alexander and Dianne Feinstein.",1
169,"Children with lead poisoning are 7 times more likely to drop out of school, more likely to engage in risk-taking behaviors, and more likely to engage in illegal activity.",1
575,"The President's budget undermines and cuts the crucial investments we have made in our cities and our neighborhoods, neighborhoods that we all come from, neighborhoods where we all recognize the importance of these communities.",1
895,"And though this conversation was not intended for public consumption, the President's comments were clearly deliberate.",1
350,Social Security is unique because it is paid for through a dedicated tax on employees who will receive future benefits.,1
725,It is for those who found the Solyndra default to be outrageous.,1
596,Some people have asked a question that I don't have a really good respond for.,4
78,"Such conditions can frequently lead, or at least contribute to, unnecessary violence.",1
264,"Mr. Chair, the issue here is, do you want to fix the possible problems with the Authorization for Use of Military Force back in 2001 when all of the cosponsors were not even here, and potentially the NDAA?",3
846,The cost of these kinds of health disparities is simply too high.,1
172,Many businesses of all kinds and sizes in our country use derivatives to manage the risks they face within their daily operations.,1
961,The reason we need this bill is to help make some of those bipartisan reforms to the infrastructure program that just don't make sense.,2
604,"Over the last 25 years, I and a small band of ""just refuse to go along and get along'' kinds here in Congress have engaged in a constant fight to maintain the intellectual property of American inventors.",1
783,"Central Texas College may be the largest community college in the United States, possibly the world; and it consistently has students of 75,000-plus every year.",1
46,All of us may never see eye to eye on what kinds of research should be supported by the Federal Government.,1
483,But this rule goes so against the principles of how we are supposed to debate the Armed Services bill--and I've been privileged to be on that committee for 16 years--that I have to speak against this rule.,1
37,It is like trying  to send an army into battle and not giving them the weapons to do it or  creating all these barriers to completion.,1
835,"Official Committee Website (a) The Chairman shall preserve an official website on behalf of the Committee for the purpose of furthering the Committee's legislative and oversight responsibilities, including communicating information about the Committee's activities to Committee Members and other Members of the House.",1
227,"Mr. Speaker, yesterday, President Obama announced that the United States, along with our P5+1 negotiating partners, had reached a deal with Iran. A deal that, if fully implemented, will prevent Iran from obtaining a nuclear weapon.",1
341,The changes that we're proposing today cut only 4 percent over the next 10 years.,1
201,"Belarus remains mired in its worst financial crisis since independence, which has put Lukashenko under increasing pressure.",1
137," Mr. Chairman, I am happy to yield 3 minutes to the gentleman from Michigan, Mr. Walberg, the chairman of the Subcommittee on Workforce Protections.",1
568,"Thus, the promotion of religious liberty is not an isolated human rights concern, but a basic component of our national security.",1
978,"Is it proper to offer an amendment at this time or at some future time on the underlying bill that would preclude Members of Congress who receive financial benefits, payments, or subsidies from the underlying legislation from voting on this bill from which they directly profit financially?",1
917,"Our guest chaplain today has been the pastor of Bible Baptist Church in Wichita Falls, Texas, for the past 20  years; but his ministry and passion for spreading the word of God has never been confined to the walls of any church building.",1
515,They don't want to recognize our Constitution. They want it supplanted and replaced with Sharia law.,1
683,"On March 27, 1919, Theodore Roosevelt sent a telegram to Mr. William Marshall Bullitt of Louisville, Kentucky, and many more respected military wartime veteran leaders across the country which indicated:  ""A conference will be held at St. Louis about May 1 for the purpose of organizing an association composed of those who have been in the land and naval forces of the United States in this  war.""",1
332,"Certainly, the whole conversation here makes it very clear that American families--American families--are being disrupted, separated day after day.",1
802,And then we asked the FCC to implement the types of reforms that we implemented in this very House to avoid abuses that had taken place in the past.,1
952,Dear Chairman Bachus: The 1 million members of the National Association of REALTORS' supports a temporary extension of National Flood Insurance Program (NFIP) authority to enable the Senate to end work on its long-term reauthorization and reform measure (S. 1940).,1
339,"Mr. Speaker, the House will consider a number of suspensions next week, a complete list of which will be indicated by close of business today.",1
798,"This is simply far too short a period of time to properly get to know the staff at the centers and the needs of the location, let alone implement new changes.",1
300,"This bill brings together government agencies, including the national labs, the energy and manufacturing industries, unions, schools, community colleges and universities, among others, and promotes cooperation and collaboration to ensure that we are tapping into a wealth of underutilized talent and are training and preparing employees for the energy and manufacturing jobs of the present and also of the future.",1
528,"Let's heed the call of the fasters, of those who pray passionately for complete immigration reform.",1
538,"Second, the resolution violates separation of powers principles by inappropriately having courts address political questions that are left to the other branches to decided.",1
556,"Why are we richer than ever before, but unable to invest in fundamental priorities?",1
871,"Mr. Speaker, the Historically Black Colleges and Universities Preservation Program exists to maintain, and stabilize historic structures on HBCU campuses through projects such as structural stabilization, masonry repair, replacement of antiquated electrical and plumbing systems, abating environmental hazards such as asbestos, ameliorating termite damage, and replacing leaking roofs.",1
780,The next morning his mother and I found him dead in his room.,1
206,"At the end of the day, if we take away this DACA status from these young Americans, we are going to have a potentially close to $500 billion adverse economic impact.",1
174,"I fear spreading misinformation and wasting resources, arresting two-thirds of a million people for something that most Americans now think should be legal, undermines what could be an effective approach.",1
696,"It is going to somewhere, to somebody in Nigeria, and the people of Nigeria need to begin to enjoy some of the prosperity with which their land has been blessed, and I hope we see that in our lifetime as well.",2
207,"People take responsibility, but there's no accountability, and no heads really roll.",1
295,LLCs and other kinds of pass-throughs make up 95 percent of all the businesses in the country.,1
503,"If a contractor fails to maintain high standards of integrity and business ethics, agencies already have the authority to suspend or debar the employer from government contracting.",1
87,He wanted to contribute me a ticket for my sign.,4
636,I don't know whether the gentleman wants to answer at all.,1
352,"Protecting the nation's border--land, air, and sea--from illegal entry of people, weapons, drugs, and contraband is vital to our homeland security, as well as economic wealth.",1
933,"Instead, under the leadership of Mr. Levin and Mr. Rangel, we had the May 10 agreement with the basic values of how we should engage other countries.",1
27,"I would like to point out something that is not getting enough attention, as the media seems to be driven over issues like charge of misdemeanor, attack on a reporter, or a Russian connection, these kind of things.",1
940,That is our responsibility in the U.S. House of Representatives.,1
185,"First, let me just say, Mr. Hoyer, our whip, talked about the 50th anniversary this year of President Johnson's War on Poverty.",1
836,"In fact, in Iowa, I think they just announced 94 in 99 counties, people there won't even have an insurance product they can try to purchase on the exchange.",1
690,"But to have this debate today and to say that you can't potentially do this because it is driven, it is a Republican agenda, because it is a war on women, if anything, this is a war for women.",1
182,"We know that liberty and freedom are not free, but it is important to be able to acknowledge these horrible and outrageous and heinous acts.",1
134,"That may be an unintended consequence, but it is a serious one that could affect our Nation's financial markets, health, and safety.",1
421,"Placing the tax on the revenue side makes it much more costly for small device makers to pay for it because many of them have high revenue levels, but much smaller gain margins.",1
256,"In most federal prisons, there are only one or two officers on duty in a cell block, meaning officers are guarding nearly 130 prisoners with virtually nothing to protect themselves.",1
125,"Joe Paterno and his wife, Sue, and their five children announced a contribution of $3.5 million to the university in 1998, bringing Paterno's lifetime giving total to more than $4 million.",1
980,"We all hope for two states, living side by side peacefully, with families secure, that they can raise their children in a future that will bring peace and prosperity and tranquillity in a troubled neighborhood of the world.",1
602,"Mr. Speaker, I want to respond to my colleague from Colorado who has raised some concerns about the issue of hydraulic fracturing.",1
1006,"But the leap from saying that most undocumented women are vulnerable to attack and saying most undocumented men are rapists is, as he might say himself, huge.",1
356,"Yes, Mr. Speaker, it is now criminal in the United States to kneel and pray in front of the White House for the restoration of religious freedom.",1
440,"So let's finish our job, Mr. Speaker, and commit to making this the year we make permanent the Federal conservation easement tax incentive.",1
800,"As such, EPA needs the ability to look into criminal activity, whether it is illegal dumping of waste, negligent dumping of toxics or oil, and the illegal importation of products from other countries by those who would choose to ignore U.S. law.",1
795,"When her husband, Paul Galanti, was shot down and taken as a prisoner of war in North Vietnam in June 1966, Phyllis did not respond with fear but, instead, became a tireless advocate for American POWs around the  world.",1
312,I rise today to recognize National Rural Health Day.,1
673,"I particularly want to say to my friends Mr. Grimm and Mr. King of New York, and I've seen several times that they've sat  and worked together collectively with our Governor, whom I also want to contribute a special thank-you to, Governor Mario Cuomo, and Governor Chris Christie from New Jersey, for working cooperatively, not as a Democrat  or a Republican, but working as an elected official to come together to the aid of people who need aid, aid from a terrible storm.",1
57,"So I say to my fellow Democrats: if cutting SNAP or other programs that help poor people is the price of admission to get anything done, any piece of major legislation passed, then we have strayed very, very far from our principles.",1
581,"Mr. Chairman, again, I would say that, based on the direction from the CNO and his directives of how the Navy is looking to reorganize itself to make sure that it has the ability to preserve maritime superiority--this came out just 5 months ago--to me, it makes perfect sense for us to be able to do that.",1
603,"On the last night we were in Israel, one of the last nights, as we finished dinner at a restaurant on the Sea of Galilee, the owner of the restaurant took the microphone and indicated that Members of the American Congress were here to stop this bad Iran deal.",1
405,"I find it very, very upsetting that this vote will, of course, be overwhelmingly in support of correcting the civil liberties of Syria and making Iran toe the line and give up on something that they're permitted to do.",1
117,We can't give in.,1
449,"Of the 92 victims of that assault on that day, 23 were children.",1
731,"Frances Willard earned her place in history by pioneering the temperance movement, breaking walls in the field of education and leading the movement to obtain women's right to vote.",1
128,It enhances sexual assault prevention for male victims.,1
310,"Thank you for joining the discussion at #CBCTalks, and we are going to continue this discussion because 46 million people in our country live in poverty; 16 million of them are children.",1
3,I believe as soon as we realize Latinos yearn to share the same American principles and aspirations as so many descendants of other immigrant groups--of Italian Americans and Irish Americans and German Americans and Asian Americans and all Americans--certainly America will thrive.,1
861,"The number one part for the Republican plan is transfer trillions of dollars of prosperity from middle class America to the wealthiest in the country who don't need it; number two, explode the deficit, because there is no way to pay for this unless you cut a bunch of stuff; and then, number three, cut more.",1
653,"Mr. Speaker, there are basic problems with flood insurance.",1
840,"Apologists for Iran say that they just need to say these types of things, as well as maintain a limited nuclear stockpile, in order to save face and preserve their national pride.",1
697,This abdication of duty has not been seen since the Harding Administration.,1
199,"Mr. Speaker, the attack on our embassy in Benghazi was a tragic reminder of the security environment in which many of our diplomats serve.",1
785,"Chairman Walden indicated that, while he does understand that the program is scheduled to run through September 30, that the analysis from the nonpartisan Medicaid and CHIP Payment and Access Commission shows that States have enough funds remaining in their accounts through the end of this year.",1
147,"There are far too many criminal laws, the number of which we don't know exactly, but which allow a violation of a regulation to be a crime, which allows the full power of the Federal Government to go after individuals.",1
462,"On Tuesday, Kansans from all across the Sunflower State wished him a happy 91st birthday.",1
941,"There are six important reforms included in this bill: It improves NFIP's financial stability; it will reduce the burden on taxpayers; it restores integrity to the FEMA mapping system; it will help bring certainty to the housing market through a 5-year reauthorization; and last, it explores ways to increase private market participation.",1
323,"In 2008, in one specific case in Georgia, that of a farmer--who did not want to mention his name for fear of retribution--his costs alone in legal fees were $525,000.",1
708,"If you turn that into a high-performing school, you'll add more value than anything else you could possibly do.",1
377,"God bless my mother, who is still alive.",1
358,"Mr. Speaker, I stand here today to advance the conversation surrounding the comprehensive tax reform.",1
477,The addition of this language is important because we do not want to create the impression that Congress principles expediency and cost-cutting over fairness.,1
925,We are supposed to be the ones who are embodying and leading in those values that we hold dear.,1
324,"Secondly, the bill seeks to enhance cooperation among monetary institutions, also regulatory authorities and law enforcement, by expanding the range of counter-illicit financing information shared with monetary institutions for the sole purpose of allowing such monetary institutions to identify and report specified illicit activity.",1
211,"A duty to preserve all the documents, particularly in light of the fact the central figure has taken the Fifth.",1
278,"It says to the people who help us draft legislation, who respond the phones in our offices, and who respond to constituent mail, who help a veteran get his benefits or a high school student apply to the military academies that, unlike every other Federal employee, their employer will not contribute a share toward their health insurance.",1
706,I believe the greatest opportunity we have here is to include efforts to move our Nation toward a greener economy as part of a comprehensive infrastructure bill.,1